STUDY NAME :  rnn_autor_ss_tuning_20s_v1
[Sanity] Mean-predictor NRMSE ≈ 1.000 (should be ~1.0)
[I 2025-09-03 23:50:18,898] Trial 0 finished with value: 0.4406331777572632 and parameters: {'hidden_dim': 384, 'num_layers': 1, 'dropout': 0.011616722433639893, 'lr': 0.0029621516588303515, 'weight_decay': 6.358358856676247e-05, 'batch_size': 64, 'tf_mode': 'linear', 'tf_start': 0.8366809019706868, 'tf_end': 0.09127267288786131, 'max_lr_mult': 3.0990257265289514}. Best is trial 0 with value: 0.4406331777572632.
[I 2025-09-04 00:24:30,036] Trial 1 finished with value: 0.6177254915237427 and parameters: {'hidden_dim': 512, 'num_layers': 2, 'dropout': 0.0912139968434072, 'lr': 0.0021576967455896826, 'weight_decay': 3.972110727381911e-06, 'batch_size': 48, 'tf_mode': 'linear', 'tf_start': 0.9897771074506667, 'tf_end': 0.2896896099223678, 'max_lr_mult': 4.233589392465845}. Best is trial 0 with value: 0.4406331777572632.
[I 2025-09-04 01:22:37,972] Trial 2 finished with value: 0.932285726070404 and parameters: {'hidden_dim': 512, 'num_layers': 3, 'dropout': 0.006877704223043679, 'lr': 0.0035067764992972213, 'weight_decay': 5.975027999960295e-06, 'batch_size': 32, 'tf_mode': 'exp', 'tf_start': 0.9550265646722229, 'tf_end': 0.28184968246925673, 'max_lr_mult': 4.579309401710596}. Best is trial 0 with value: 0.4406331777572632.
[I 2025-09-04 01:47:05,611] Trial 3 finished with value: 0.647702693939209 and parameters: {'hidden_dim': 384, 'num_layers': 2, 'dropout': 0.07773545793789641, 'lr': 0.00028907721743726757, 'weight_decay': 0.0003063462210622083, 'batch_size': 64, 'tf_mode': 'cos', 'tf_start': 0.9973773873201035, 'tf_end': 0.23167343078899721, 'max_lr_mult': 1.7948627261366896}. Best is trial 0 with value: 0.4406331777572632.
[I 2025-09-04 02:27:07,735] Trial 4 finished with value: 0.7106274366378784 and parameters: {'hidden_dim': 384, 'num_layers': 1, 'dropout': 0.07169314570885453, 'lr': 0.0001573468512939367, 'weight_decay': 0.00038842777547031416, 'batch_size': 32, 'tf_mode': 'exp', 'tf_start': 0.9275114942710426, 'tf_end': 0.26616382277289796, 'max_lr_mult': 2.888859700647797}. Best is trial 0 with value: 0.4406331777572632.
[I 2025-09-04 02:56:54,950] Trial 5 finished with value: 0.35443615913391113 and parameters: {'hidden_dim': 768, 'num_layers': 3, 'dropout': 0.10454656587639882, 'lr': 0.0005325732706437209, 'weight_decay': 1.1919481947918734e-06, 'batch_size': 64, 'tf_mode': 'exp', 'tf_start': 0.849858445829775, 'tf_end': 0.12311487691068891, 'max_lr_mult': 4.022204554172195}. Best is trial 5 with value: 0.35443615913391113.
[I 2025-09-04 03:06:36,773] Trial 6 pruned. 
[I 2025-09-04 03:13:46,444] Trial 7 pruned. 
[I 2025-09-04 03:47:53,676] Trial 8 finished with value: 0.5227439999580383 and parameters: {'hidden_dim': 512, 'num_layers': 2, 'dropout': 0.18165317719333074, 'lr': 0.0002552751067201735, 'weight_decay': 2.720724805948669e-06, 'batch_size': 48, 'tf_mode': 'cos', 'tf_start': 0.9456432697223719, 'tf_end': 0.11033493981577597, 'max_lr_mult': 3.529223322374318}. Best is trial 5 with value: 0.35443615913391113.
[I 2025-09-04 04:15:28,328] Trial 9 finished with value: 0.42540493607521057 and parameters: {'hidden_dim': 640, 'num_layers': 1, 'dropout': 0.008155028310952784, 'lr': 0.0010090423315981853, 'weight_decay': 0.00010781845035122267, 'batch_size': 48, 'tf_mode': 'exp', 'tf_start': 0.8773470692601075, 'tf_end': 0.28101899662102037, 'max_lr_mult': 1.550083776583973}. Best is trial 5 with value: 0.35443615913391113.
[I 2025-09-04 04:21:17,590] Trial 10 pruned. 
[I 2025-09-04 04:31:23,462] Trial 11 pruned. 
[I 2025-09-04 04:56:52,071] Trial 12 finished with value: 0.43447691202163696 and parameters: {'hidden_dim': 768, 'num_layers': 2, 'dropout': 0.1616892107728863, 'lr': 0.0002698760927667085, 'weight_decay': 4.388470298502957e-06, 'batch_size': 64, 'tf_mode': 'exp', 'tf_start': 0.8329878894852957, 'tf_end': 0.09989783749915504, 'max_lr_mult': 3.203737165307312}. Best is trial 5 with value: 0.35443615913391113.
[I 2025-09-04 05:02:26,840] Trial 13 pruned. 
[I 2025-09-04 05:43:38,566] Trial 14 finished with value: 0.4377964735031128 and parameters: {'hidden_dim': 512, 'num_layers': 1, 'dropout': 0.01234869348534675, 'lr': 0.0014647929923858206, 'weight_decay': 1.1474849886780717e-05, 'batch_size': 32, 'tf_mode': 'exp', 'tf_start': 0.8126557219247552, 'tf_end': 0.25871428536156693, 'max_lr_mult': 1.2101049182423371}. Best is trial 5 with value: 0.35443615913391113.
[I 2025-09-04 06:17:29,734] Trial 15 finished with value: 0.35314077138900757 and parameters: {'hidden_dim': 768, 'num_layers': 4, 'dropout': 0.05766257733016251, 'lr': 0.0007718713977086789, 'weight_decay': 7.5673532624691985e-06, 'batch_size': 64, 'tf_mode': 'exp', 'tf_start': 0.8070185570946925, 'tf_end': 0.13036974199663592, 'max_lr_mult': 4.624444557345125}. Best is trial 15 with value: 0.35314077138900757.
[I 2025-09-04 06:50:45,041] Trial 16 finished with value: 0.331290066242218 and parameters: {'hidden_dim': 640, 'num_layers': 4, 'dropout': 0.05054306247970516, 'lr': 0.00040637562490977236, 'weight_decay': 2.505063106776998e-05, 'batch_size': 64, 'tf_mode': 'linear', 'tf_start': 0.812637195307123, 'tf_end': 0.17225103364271577, 'max_lr_mult': 4.946330933818727}. Best is trial 16 with value: 0.331290066242218.
[I 2025-09-04 07:28:22,151] Trial 17 finished with value: 0.31599557399749756 and parameters: {'hidden_dim': 640, 'num_layers': 5, 'dropout': 0.02162179628544789, 'lr': 0.0003710658344382521, 'weight_decay': 2.9641338664337875e-05, 'batch_size': 64, 'tf_mode': 'exp', 'tf_start': 0.8347476661244906, 'tf_end': 0.19693473055588806, 'max_lr_mult': 4.740615299404904}. Best is trial 17 with value: 0.31599557399749756.
[I 2025-09-04 08:05:41,415] Trial 18 finished with value: 0.3827265501022339 and parameters: {'hidden_dim': 640, 'num_layers': 5, 'dropout': 0.00623878458616485, 'lr': 0.00015838570022745199, 'weight_decay': 2.8221731772315357e-05, 'batch_size': 64, 'tf_mode': 'linear', 'tf_start': 0.842329043920034, 'tf_end': 0.14868879343927885, 'max_lr_mult': 4.992883398147534}. Best is trial 17 with value: 0.31599557399749756.
[I 2025-09-04 09:20:03,023] Trial 19 finished with value: 0.3322595953941345 and parameters: {'hidden_dim': 640, 'num_layers': 5, 'dropout': 0.033325802666134566, 'lr': 0.00017715483956826897, 'weight_decay': 6.663974287214128e-05, 'batch_size': 32, 'tf_mode': 'exp', 'tf_start': 0.8326957246181267, 'tf_end': 0.2830004069866738, 'max_lr_mult': 4.111280451378654}. Best is trial 17 with value: 0.31599557399749756.

✅ Best trial:
  Value: 0.31599557399749756
  Params: {'hidden_dim': 640, 'num_layers': 5, 'dropout': 0.02162179628544789, 'lr': 0.0003710658344382521, 'weight_decay': 2.9641338664337875e-05, 'batch_size': 64, 'tf_mode': 'exp', 'tf_start': 0.8347476661244906, 'tf_end': 0.19693473055588806, 'max_lr_mult': 4.740615299404904}

📊 Dashboard hint:
optuna-dashboard sqlite://///gpfs/workdir/lagardema/MANON/optuna_rnn_autorss_20s_v1.db --port 5010 --host 127.0.0.1
