[Sanity] Mean-predictor NRMSE ≈ 1.000 (should be ~1.0)
[I 2025-09-03 17:09:53,808] Trial 0 finished with value: 0.37161824107170105 and parameters: {'hidden_dim': 384, 'num_layers': 1, 'dropout': 0.011616722433639893, 'lr': 0.0029621516588303515, 'weight_decay': 6.358358856676247e-05, 'batch_size': 64, 'tf_mode': 'linear', 'tf_start': 0.8366809019706868, 'tf_end': 0.09127267288786131, 'max_lr_mult': 3.0990257265289514}. Best is trial 0 with value: 0.37161824107170105.
[I 2025-09-03 17:20:30,154] Trial 1 finished with value: 0.5601567625999451 and parameters: {'hidden_dim': 512, 'num_layers': 2, 'dropout': 0.0912139968434072, 'lr': 0.0021576967455896826, 'weight_decay': 3.972110727381911e-06, 'batch_size': 48, 'tf_mode': 'linear', 'tf_start': 0.9897771074506667, 'tf_end': 0.2896896099223678, 'max_lr_mult': 4.233589392465845}. Best is trial 0 with value: 0.37161824107170105.
[I 2025-09-03 17:39:34,750] Trial 2 finished with value: 0.8671897053718567 and parameters: {'hidden_dim': 512, 'num_layers': 3, 'dropout': 0.006877704223043679, 'lr': 0.0035067764992972213, 'weight_decay': 5.975027999960295e-06, 'batch_size': 32, 'tf_mode': 'exp', 'tf_start': 0.9550265646722229, 'tf_end': 0.28184968246925673, 'max_lr_mult': 4.579309401710596}. Best is trial 0 with value: 0.37161824107170105.
[I 2025-09-03 17:47:31,454] Trial 3 finished with value: 0.5893341302871704 and parameters: {'hidden_dim': 384, 'num_layers': 2, 'dropout': 0.07773545793789641, 'lr': 0.00028907721743726757, 'weight_decay': 0.0003063462210622083, 'batch_size': 64, 'tf_mode': 'cos', 'tf_start': 0.9973773873201035, 'tf_end': 0.23167343078899721, 'max_lr_mult': 1.7948627261366896}. Best is trial 0 with value: 0.37161824107170105.
[I 2025-09-03 18:03:11,270] Trial 4 finished with value: 0.7115764617919922 and parameters: {'hidden_dim': 384, 'num_layers': 1, 'dropout': 0.07169314570885453, 'lr': 0.0001573468512939367, 'weight_decay': 0.00038842777547031416, 'batch_size': 32, 'tf_mode': 'exp', 'tf_start': 0.9275114942710426, 'tf_end': 0.26616382277289796, 'max_lr_mult': 2.888859700647797}. Best is trial 0 with value: 0.37161824107170105.
[I 2025-09-03 18:13:03,080] Trial 5 finished with value: 0.19392874836921692 and parameters: {'hidden_dim': 768, 'num_layers': 3, 'dropout': 0.10454656587639882, 'lr': 0.0005325732706437209, 'weight_decay': 1.1919481947918734e-06, 'batch_size': 64, 'tf_mode': 'exp', 'tf_start': 0.849858445829775, 'tf_end': 0.12311487691068891, 'max_lr_mult': 4.022204554172195}. Best is trial 5 with value: 0.19392874836921692.
[I 2025-09-03 18:16:15,202] Trial 6 pruned. 
[I 2025-09-03 18:23:28,034] Trial 7 pruned. 
[I 2025-09-03 18:34:03,153] Trial 8 finished with value: 0.4064828157424927 and parameters: {'hidden_dim': 512, 'num_layers': 2, 'dropout': 0.18165317719333074, 'lr': 0.0002552751067201735, 'weight_decay': 2.720724805948669e-06, 'batch_size': 48, 'tf_mode': 'cos', 'tf_start': 0.9456432697223719, 'tf_end': 0.11033493981577597, 'max_lr_mult': 3.529223322374318}. Best is trial 5 with value: 0.19392874836921692.
[I 2025-09-03 18:44:33,200] Trial 9 finished with value: 0.33078423142433167 and parameters: {'hidden_dim': 640, 'num_layers': 1, 'dropout': 0.008155028310952784, 'lr': 0.0010090423315981853, 'weight_decay': 0.00010781845035122267, 'batch_size': 48, 'tf_mode': 'exp', 'tf_start': 0.8773470692601075, 'tf_end': 0.28101899662102037, 'max_lr_mult': 1.550083776583973}. Best is trial 5 with value: 0.19392874836921692.
[I 2025-09-03 18:46:27,186] Trial 10 pruned. 
[I 2025-09-03 18:57:00,326] Trial 11 finished with value: 0.3549269735813141 and parameters: {'hidden_dim': 640, 'num_layers': 2, 'dropout': 0.06039093141509451, 'lr': 0.0014752482400133204, 'weight_decay': 0.00031278167421163404, 'batch_size': 48, 'tf_mode': 'exp', 'tf_start': 0.8414284169092331, 'tf_end': 0.2939142068690206, 'max_lr_mult': 1.7907968859299546}. Best is trial 5 with value: 0.19392874836921692.
[I 2025-09-03 19:04:55,721] Trial 12 finished with value: 0.28199446201324463 and parameters: {'hidden_dim': 768, 'num_layers': 2, 'dropout': 0.1616892107728863, 'lr': 0.0002698760927667085, 'weight_decay': 4.388470298502957e-06, 'batch_size': 64, 'tf_mode': 'exp', 'tf_start': 0.8329878894852957, 'tf_end': 0.09989783749915504, 'max_lr_mult': 3.203737165307312}. Best is trial 5 with value: 0.19392874836921692.
[I 2025-09-03 19:15:23,965] Trial 13 finished with value: 0.23980498313903809 and parameters: {'hidden_dim': 768, 'num_layers': 4, 'dropout': 0.1637687545499484, 'lr': 0.00019014574988416194, 'weight_decay': 1.7109953691758684e-06, 'batch_size': 64, 'tf_mode': 'exp', 'tf_start': 0.8481655640771317, 'tf_end': 0.12620905144913544, 'max_lr_mult': 2.9574071683453704}. Best is trial 5 with value: 0.19392874836921692.
[I 2025-09-03 19:38:53,164] Trial 14 finished with value: 0.19247332215309143 and parameters: {'hidden_dim': 768, 'num_layers': 5, 'dropout': 0.16400359643071916, 'lr': 0.0003418267963509751, 'weight_decay': 4.345737537833164e-06, 'batch_size': 32, 'tf_mode': 'exp', 'tf_start': 0.8660061497892938, 'tf_end': 0.18021675378590934, 'max_lr_mult': 4.643946755932873}. Best is trial 14 with value: 0.19247332215309143.
[I 2025-09-03 19:49:22,411] Trial 15 finished with value: 0.17694637179374695 and parameters: {'hidden_dim': 768, 'num_layers': 4, 'dropout': 0.05766257733016251, 'lr': 0.0007718713977086789, 'weight_decay': 7.5673532624691985e-06, 'batch_size': 64, 'tf_mode': 'exp', 'tf_start': 0.8070185570946925, 'tf_end': 0.13036974199663592, 'max_lr_mult': 4.624444557345125}. Best is trial 15 with value: 0.17694637179374695.
[I 2025-09-03 20:10:36,911] Trial 16 finished with value: 0.19566217064857483 and parameters: {'hidden_dim': 768, 'num_layers': 4, 'dropout': 0.18240538848438329, 'lr': 0.0007447059388747905, 'weight_decay': 1.8273530090847122e-05, 'batch_size': 32, 'tf_mode': 'exp', 'tf_start': 0.8206631526843127, 'tf_end': 0.24309261488852052, 'max_lr_mult': 4.102009341740925}. Best is trial 15 with value: 0.17694637179374695.
[I 2025-09-03 20:22:14,538] Trial 17 finished with value: 0.15807273983955383 and parameters: {'hidden_dim': 768, 'num_layers': 5, 'dropout': 0.024633540661842708, 'lr': 0.0006336334451632603, 'weight_decay': 1.1115948817163433e-05, 'batch_size': 64, 'tf_mode': 'exp', 'tf_start': 0.8325171034722307, 'tf_end': 0.1614325415109388, 'max_lr_mult': 4.671682433566116}. Best is trial 17 with value: 0.15807273983955383.
[I 2025-09-03 20:32:43,724] Trial 18 finished with value: 0.1727953553199768 and parameters: {'hidden_dim': 768, 'num_layers': 4, 'dropout': 0.019304451061576543, 'lr': 0.0003959989566473586, 'weight_decay': 9.95167347138098e-06, 'batch_size': 64, 'tf_mode': 'exp', 'tf_start': 0.8011551948433558, 'tf_end': 0.17280539784992335, 'max_lr_mult': 4.725258418365162}. Best is trial 17 with value: 0.15807273983955383.
[I 2025-09-03 20:35:00,932] Trial 19 pruned. 
[I 2025-09-03 20:46:43,557] Trial 20 finished with value: 0.15669628977775574 and parameters: {'hidden_dim': 768, 'num_layers': 5, 'dropout': 0.000962522451861663, 'lr': 0.0004676623915263429, 'weight_decay': 1.7829541062852624e-06, 'batch_size': 64, 'tf_mode': 'exp', 'tf_start': 0.8968111599833097, 'tf_end': 0.190387431978285, 'max_lr_mult': 3.2963751280702485}. Best is trial 20 with value: 0.15669628977775574.
[I 2025-09-03 20:57:11,822] Trial 21 finished with value: 0.17090152204036713 and parameters: {'hidden_dim': 768, 'num_layers': 4, 'dropout': 0.005443805278239358, 'lr': 0.0003759007747480266, 'weight_decay': 2.1631442685410327e-06, 'batch_size': 64, 'tf_mode': 'linear', 'tf_start': 0.9073602475352938, 'tf_end': 0.1998898901083006, 'max_lr_mult': 2.408597005485321}. Best is trial 20 with value: 0.15669628977775574.
[I 2025-09-03 21:07:41,934] Trial 22 finished with value: 0.15224818885326385 and parameters: {'hidden_dim': 768, 'num_layers': 4, 'dropout': 0.009231305255951195, 'lr': 0.0006153417070739844, 'weight_decay': 2.2461736431765128e-06, 'batch_size': 64, 'tf_mode': 'linear', 'tf_start': 0.9542391371090236, 'tf_end': 0.19259056433669797, 'max_lr_mult': 2.742270947391911}. Best is trial 22 with value: 0.15224818885326385.
[I 2025-09-03 21:19:21,180] Trial 23 finished with value: 0.15921926498413086 and parameters: {'hidden_dim': 768, 'num_layers': 5, 'dropout': 0.03214844248915742, 'lr': 0.00042624780108344956, 'weight_decay': 1.309737825111778e-06, 'batch_size': 64, 'tf_mode': 'cos', 'tf_start': 0.9988252959105438, 'tf_end': 0.19821090484834464, 'max_lr_mult': 3.29262132746445}. Best is trial 22 with value: 0.15224818885326385.
[I 2025-09-03 21:22:22,717] Trial 24 pruned. 
[I 2025-09-03 21:34:04,821] Trial 25 finished with value: 0.173416867852211 and parameters: {'hidden_dim': 640, 'num_layers': 5, 'dropout': 0.021938663741314788, 'lr': 0.0006756982282155219, 'weight_decay': 3.6539457300650165e-06, 'batch_size': 64, 'tf_mode': 'exp', 'tf_start': 0.9169144666190661, 'tf_end': 0.16426109783360943, 'max_lr_mult': 3.239478845056881}. Best is trial 22 with value: 0.15224818885326385.
[I 2025-09-03 21:36:10,333] Trial 26 pruned. 
[I 2025-09-03 21:45:36,455] Trial 27 pruned. 
[I 2025-09-03 21:57:18,572] Trial 28 finished with value: 0.1593279242515564 and parameters: {'hidden_dim': 640, 'num_layers': 5, 'dropout': 0.0008035904192111067, 'lr': 0.0007926708144236392, 'weight_decay': 1.3848827970135233e-05, 'batch_size': 64, 'tf_mode': 'linear', 'tf_start': 0.9963621924263564, 'tf_end': 0.27950581121927576, 'max_lr_mult': 1.8129718042631902}. Best is trial 22 with value: 0.15224818885326385.
[I 2025-09-03 21:59:37,852] Trial 29 pruned. 
[I 2025-09-03 22:02:40,475] Trial 30 pruned. 
[I 2025-09-03 22:13:08,781] Trial 31 finished with value: 0.16162176430225372 and parameters: {'hidden_dim': 768, 'num_layers': 4, 'dropout': 0.006689496205957605, 'lr': 0.000492997723089476, 'weight_decay': 1.0322072033923173e-06, 'batch_size': 64, 'tf_mode': 'cos', 'tf_start': 0.9887928552328269, 'tf_end': 0.1898867822460584, 'max_lr_mult': 3.500448847281329}. Best is trial 22 with value: 0.15224818885326385.
[I 2025-09-03 22:24:48,525] Trial 32 finished with value: 0.1681058555841446 and parameters: {'hidden_dim': 768, 'num_layers': 5, 'dropout': 0.0550011844440039, 'lr': 0.0002941615346528817, 'weight_decay': 1.275251063194152e-06, 'batch_size': 64, 'tf_mode': 'exp', 'tf_start': 0.9158031246047885, 'tf_end': 0.1893440937371917, 'max_lr_mult': 3.623411426404252}. Best is trial 22 with value: 0.15224818885326385.
[I 2025-09-03 22:27:49,483] Trial 33 pruned. 
[I 2025-09-03 22:30:38,954] Trial 34 pruned. 
[I 2025-09-03 22:44:38,111] Trial 35 finished with value: 0.1481170356273651 and parameters: {'hidden_dim': 768, 'num_layers': 4, 'dropout': 0.02323541564951515, 'lr': 0.0004294664323193436, 'weight_decay': 3.0009982878010767e-06, 'batch_size': 48, 'tf_mode': 'linear', 'tf_start': 0.9943741972305831, 'tf_end': 0.16099599898364725, 'max_lr_mult': 1.8011151046022158}. Best is trial 35 with value: 0.1481170356273651.
[I 2025-09-03 22:47:25,302] Trial 36 pruned. 
[I 2025-09-03 22:50:14,318] Trial 37 pruned. 
[I 2025-09-03 23:11:12,103] Trial 38 finished with value: 0.15510982275009155 and parameters: {'hidden_dim': 768, 'num_layers': 4, 'dropout': 0.01238539093523027, 'lr': 0.0005307815973178214, 'weight_decay': 1.2182363753620617e-06, 'batch_size': 32, 'tf_mode': 'linear', 'tf_start': 0.9844470700487171, 'tf_end': 0.2605986236370233, 'max_lr_mult': 1.7795622217722227}. Best is trial 35 with value: 0.1481170356273651.
[I 2025-09-03 23:29:58,151] Trial 39 finished with value: 0.16010180115699768 and parameters: {'hidden_dim': 768, 'num_layers': 3, 'dropout': 0.001879122948243191, 'lr': 0.0004687086755912616, 'weight_decay': 2.4643242817393426e-06, 'batch_size': 32, 'tf_mode': 'linear', 'tf_start': 0.9930875250591356, 'tf_end': 0.28243215930330134, 'max_lr_mult': 2.4738941062877564}. Best is trial 35 with value: 0.1481170356273651.

✅ Best trial:
  Value: 0.1481170356273651
  Params: {'hidden_dim': 768, 'num_layers': 4, 'dropout': 0.02323541564951515, 'lr': 0.0004294664323193436, 'weight_decay': 3.0009982878010767e-06, 'batch_size': 48, 'tf_mode': 'linear', 'tf_start': 0.9943741972305831, 'tf_end': 0.16099599898364725, 'max_lr_mult': 1.8011151046022158}

📊 Dashboard hint:
optuna-dashboard sqlite://///gpfs/workdir/lagardema/MANON/optuna_rnn_gru_lstm_autor_ss.db --port 5010 --host 127.0.0.1
