[Sanity] Mean-predictor NRMSE ≈ 1.000 (should be ~1.0)
[I 2025-09-03 17:31:18,096] Trial 0 finished with value: 0.36501064896583557 and parameters: {'hidden_dim': 384, 'num_layers': 1, 'dropout': 0.011616722433639893, 'lr': 0.0029621516588303515, 'weight_decay': 6.358358856676247e-05, 'batch_size': 64, 'tf_mode': 'linear', 'tf_start': 0.8366809019706868, 'tf_end': 0.09127267288786131, 'max_lr_mult': 3.0990257265289514}. Best is trial 0 with value: 0.36501064896583557.
[I 2025-09-03 17:51:19,207] Trial 1 finished with value: 0.5479083061218262 and parameters: {'hidden_dim': 512, 'num_layers': 2, 'dropout': 0.0912139968434072, 'lr': 0.0021576967455896826, 'weight_decay': 3.972110727381911e-06, 'batch_size': 48, 'tf_mode': 'linear', 'tf_start': 0.9897771074506667, 'tf_end': 0.2896896099223678, 'max_lr_mult': 4.233589392465845}. Best is trial 0 with value: 0.36501064896583557.
[I 2025-09-03 18:23:10,914] Trial 2 finished with value: 0.7360050082206726 and parameters: {'hidden_dim': 512, 'num_layers': 3, 'dropout': 0.006877704223043679, 'lr': 0.0035067764992972213, 'weight_decay': 5.975027999960295e-06, 'batch_size': 32, 'tf_mode': 'exp', 'tf_start': 0.9550265646722229, 'tf_end': 0.28184968246925673, 'max_lr_mult': 4.579309401710596}. Best is trial 0 with value: 0.36501064896583557.
[I 2025-09-03 18:37:15,703] Trial 3 finished with value: 0.589467465877533 and parameters: {'hidden_dim': 384, 'num_layers': 2, 'dropout': 0.07773545793789641, 'lr': 0.00028907721743726757, 'weight_decay': 0.0003063462210622083, 'batch_size': 64, 'tf_mode': 'cos', 'tf_start': 0.9973773873201035, 'tf_end': 0.23167343078899721, 'max_lr_mult': 1.7948627261366896}. Best is trial 0 with value: 0.36501064896583557.
[I 2025-09-03 19:00:50,394] Trial 4 finished with value: 0.7077075839042664 and parameters: {'hidden_dim': 384, 'num_layers': 1, 'dropout': 0.07169314570885453, 'lr': 0.0001573468512939367, 'weight_decay': 0.00038842777547031416, 'batch_size': 32, 'tf_mode': 'exp', 'tf_start': 0.9275114942710426, 'tf_end': 0.26616382277289796, 'max_lr_mult': 2.888859700647797}. Best is trial 0 with value: 0.36501064896583557.
[I 2025-09-03 19:16:56,443] Trial 5 finished with value: 0.19424495100975037 and parameters: {'hidden_dim': 768, 'num_layers': 3, 'dropout': 0.10454656587639882, 'lr': 0.0005325732706437209, 'weight_decay': 1.1919481947918734e-06, 'batch_size': 64, 'tf_mode': 'exp', 'tf_start': 0.849858445829775, 'tf_end': 0.12311487691068891, 'max_lr_mult': 4.022204554172195}. Best is trial 5 with value: 0.19424495100975037.
[I 2025-09-03 19:22:26,951] Trial 6 pruned. 
[I 2025-09-03 19:35:05,966] Trial 7 pruned. 
[I 2025-09-03 19:54:44,522] Trial 8 finished with value: 0.38050228357315063 and parameters: {'hidden_dim': 512, 'num_layers': 2, 'dropout': 0.18165317719333074, 'lr': 0.0002552751067201735, 'weight_decay': 2.720724805948669e-06, 'batch_size': 48, 'tf_mode': 'cos', 'tf_start': 0.9456432697223719, 'tf_end': 0.11033493981577597, 'max_lr_mult': 3.529223322374318}. Best is trial 5 with value: 0.19424495100975037.
[I 2025-09-03 20:12:00,798] Trial 9 finished with value: 0.3331649899482727 and parameters: {'hidden_dim': 640, 'num_layers': 1, 'dropout': 0.008155028310952784, 'lr': 0.0010090423315981853, 'weight_decay': 0.00010781845035122267, 'batch_size': 48, 'tf_mode': 'exp', 'tf_start': 0.8773470692601075, 'tf_end': 0.28101899662102037, 'max_lr_mult': 1.550083776583973}. Best is trial 5 with value: 0.19424495100975037.
[I 2025-09-03 20:15:13,290] Trial 10 pruned. 
[I 2025-09-03 20:34:47,771] Trial 11 finished with value: 0.3549574315547943 and parameters: {'hidden_dim': 640, 'num_layers': 2, 'dropout': 0.06039093141509451, 'lr': 0.0014752482400133204, 'weight_decay': 0.00031278167421163404, 'batch_size': 48, 'tf_mode': 'exp', 'tf_start': 0.8414284169092331, 'tf_end': 0.2939142068690206, 'max_lr_mult': 1.7907968859299546}. Best is trial 5 with value: 0.19424495100975037.
[I 2025-09-03 20:49:34,615] Trial 12 finished with value: 0.27635085582733154 and parameters: {'hidden_dim': 768, 'num_layers': 2, 'dropout': 0.1616892107728863, 'lr': 0.0002698760927667085, 'weight_decay': 4.388470298502957e-06, 'batch_size': 64, 'tf_mode': 'exp', 'tf_start': 0.8329878894852957, 'tf_end': 0.09989783749915504, 'max_lr_mult': 3.203737165307312}. Best is trial 5 with value: 0.19424495100975037.
[I 2025-09-03 21:08:10,818] Trial 13 finished with value: 0.23860760033130646 and parameters: {'hidden_dim': 768, 'num_layers': 4, 'dropout': 0.1637687545499484, 'lr': 0.00019014574988416194, 'weight_decay': 1.7109953691758684e-06, 'batch_size': 64, 'tf_mode': 'exp', 'tf_start': 0.8481655640771317, 'tf_end': 0.12620905144913544, 'max_lr_mult': 2.9574071683453704}. Best is trial 5 with value: 0.19424495100975037.
[I 2025-09-03 21:50:09,469] Trial 14 finished with value: 0.19003447890281677 and parameters: {'hidden_dim': 768, 'num_layers': 5, 'dropout': 0.16400359643071916, 'lr': 0.0003418267963509751, 'weight_decay': 4.345737537833164e-06, 'batch_size': 32, 'tf_mode': 'exp', 'tf_start': 0.8660061497892938, 'tf_end': 0.18021675378590934, 'max_lr_mult': 4.643946755932873}. Best is trial 14 with value: 0.19003447890281677.
[I 2025-09-03 22:08:42,640] Trial 15 finished with value: 0.16588687896728516 and parameters: {'hidden_dim': 768, 'num_layers': 4, 'dropout': 0.05766257733016251, 'lr': 0.0007718713977086789, 'weight_decay': 7.5673532624691985e-06, 'batch_size': 64, 'tf_mode': 'exp', 'tf_start': 0.8070185570946925, 'tf_end': 0.13036974199663592, 'max_lr_mult': 4.624444557345125}. Best is trial 15 with value: 0.16588687896728516.
[I 2025-09-03 22:45:43,315] Trial 16 finished with value: 0.20366530120372772 and parameters: {'hidden_dim': 768, 'num_layers': 4, 'dropout': 0.18240538848438329, 'lr': 0.0007447059388747905, 'weight_decay': 1.8273530090847122e-05, 'batch_size': 32, 'tf_mode': 'exp', 'tf_start': 0.8206631526843127, 'tf_end': 0.24309261488852052, 'max_lr_mult': 4.102009341740925}. Best is trial 15 with value: 0.16588687896728516.
[I 2025-09-03 23:06:44,652] Trial 17 finished with value: 0.16809560358524323 and parameters: {'hidden_dim': 768, 'num_layers': 5, 'dropout': 0.024633540661842708, 'lr': 0.0006336334451632603, 'weight_decay': 1.1115948817163433e-05, 'batch_size': 64, 'tf_mode': 'exp', 'tf_start': 0.8325171034722307, 'tf_end': 0.1614325415109388, 'max_lr_mult': 4.671682433566116}. Best is trial 15 with value: 0.16588687896728516.
[I 2025-09-03 23:25:17,157] Trial 18 finished with value: 0.16970251500606537 and parameters: {'hidden_dim': 768, 'num_layers': 4, 'dropout': 0.019304451061576543, 'lr': 0.0003959989566473586, 'weight_decay': 9.95167347138098e-06, 'batch_size': 64, 'tf_mode': 'exp', 'tf_start': 0.8011551948433558, 'tf_end': 0.17280539784992335, 'max_lr_mult': 4.725258418365162}. Best is trial 15 with value: 0.16588687896728516.
[I 2025-09-03 23:28:45,387] Trial 19 pruned. 

✅ Best trial:
  Value: 0.16588687896728516
  Params: {'hidden_dim': 768, 'num_layers': 4, 'dropout': 0.05766257733016251, 'lr': 0.0007718713977086789, 'weight_decay': 7.5673532624691985e-06, 'batch_size': 64, 'tf_mode': 'exp', 'tf_start': 0.8070185570946925, 'tf_end': 0.13036974199663592, 'max_lr_mult': 4.624444557345125}

📊 Dashboard hint:
optuna-dashboard sqlite://///gpfs/workdir/lagardema/MANON/optuna_rnn_autorss_v2.db --port 5010 --host 127.0.0.1
